{
  "contract_version": "1.0.0",
  "analysis_id": "00000000-0000-0000-0000-000000000064",
  "status": "warning",
  "sources": [
    {
      "uuid": "00000000-0000-0000-0000-000000000001",
      "uri": "eml:///wellforge/fixture/1",
      "object_type": "well",
      "content_hash": "sha256:0000000000000000000000000000000000000000000000000000000000000001",
      "citation_name": "synthetic-Well",
      "source_system": "wellforge-synthetic-1"
    },
    {
      "uuid": "00000000-0000-0000-0000-000000000002",
      "uri": "eml:///wellforge/fixture/2",
      "object_type": "wellbore",
      "content_hash": "sha256:0000000000000000000000000000000000000000000000000000000000000002",
      "citation_name": "synthetic-Wellbore",
      "source_system": "wellforge-synthetic-1"
    },
    {
      "uuid": "00000000-0000-0000-0000-000000000003",
      "uri": "eml:///wellforge/fixture/3",
      "object_type": "trajectory",
      "content_hash": "sha256:0000000000000000000000000000000000000000000000000000000000000003",
      "citation_name": "synthetic-Trajectory",
      "source_system": "wellforge-synthetic-1"
    },
    {
      "uuid": "00000000-0000-0000-0000-000000000004",
      "uri": "eml:///wellforge/fixture/4",
      "object_type": "wellboreGeometry",
      "content_hash": "sha256:0000000000000000000000000000000000000000000000000000000000000004",
      "citation_name": "synthetic-WellboreGeometry",
      "source_system": "wellforge-synthetic-1"
    },
    {
      "uuid": "00000000-0000-0000-0000-000000000005",
      "uri": "eml:///wellforge/fixture/5",
      "object_type": "tubular",
      "content_hash": "sha256:0000000000000000000000000000000000000000000000000000000000000005",
      "citation_name": "synthetic-Tubular",
      "source_system": "wellforge-synthetic-1"
    },
    {
      "uuid": "00000000-0000-0000-0000-000000000006",
      "uri": "eml:///wellforge/fixture/6",
      "object_type": "bhaRun",
      "content_hash": "sha256:0000000000000000000000000000000000000000000000000000000000000006",
      "citation_name": "synthetic-BhaRun",
      "source_system": "wellforge-synthetic-1"
    }
  ],
  "static_nodes": [
    {
      "md_m": 0.0,
      "x_m": 0.0,
      "y_m": 0.0,
      "od_radius_m": 0.1016,
      "id_radius_m": 0.0357,
      "hole_radius_m": 0.155575,
      "projected_clearance_m": 0.053974999999999995,
      "bending_moment_n_m": 0.0,
      "bending_stress_pa": 0.0
    },
    {
      "md_m": 0.5,
      "x_m": 0.0009521091486677979,
      "y_m": 0.0,
      "od_radius_m": 0.1016,
      "id_radius_m": 0.0357,
      "hole_radius_m": 0.155575,
      "projected_clearance_m": 0.05302289085133219,
      "bending_moment_n_m": 122655.60579408183,
      "bending_stress_pa": 151212518.55102736
    },
    {
      "md_m": 1.0,
      "x_m": 0.0037030872183166294,
      "y_m": 0.0,
      "od_radius_m": 0.1016,
      "id_radius_m": 0.0357,
      "hole_radius_m": 0.155575,
      "projected_clearance_m": 0.05027191278168336,
      "bending_moment_n_m": 112228.33452066558,
      "bending_stress_pa": 138357550.03442225
    },
    {
      "md_m": 1.5,
      "x_m": 0.008100007694883393,
      "y_m": 0.0,
      "od_radius_m": 0.1016,
      "id_radius_m": 0.0357,
      "hole_radius_m": 0.155575,
      "projected_clearance_m": 0.0458749923051166,
      "bending_moment_n_m": 102264.49752606628,
      "bending_stress_pa": 126073913.45188655
    },
    {
      "md_m": 2.0,
      "x_m": 0.013996740798263326,
      "y_m": 0.0,
      "od_radius_m": 0.1016,
      "id_radius_m": 0.0357,
      "hole_radius_m": 0.155575,
      "projected_clearance_m": 0.03997825920173667,
      "bending_moment_n_m": 92764.09481028363,
      "bending_stress_pa": 114361608.80341993
    },
    {
      "md_m": 2.5,
      "x_m": 0.021253953482309997,
      "y_m": 0.0,
      "od_radius_m": 0.1016,
      "id_radius_m": 0.0357,
      "hole_radius_m": 0.155575,
      "projected_clearance_m": 0.032721046517690006,
      "bending_moment_n_m": 83727.1263733173,
      "bending_stress_pa": 103220636.08902195
    },
    {
      "md_m": 3.0,
      "x_m": 0.029739109434835303,
      "y_m": 0.0,
      "od_radius_m": 0.1016,
      "id_radius_m": 0.0357,
      "hole_radius_m": 0.155575,
      "projected_clearance_m": 0.024235890565164703,
      "bending_moment_n_m": 75153.59221517012,
      "bending_stress_pa": 92650995.30869614
    },
    {
      "md_m": 3.5,
      "x_m": 0.03932646907760951,
      "y_m": 0.0,
      "od_radius_m": 0.1016,
      "id_radius_m": 0.0357,
      "hole_radius_m": 0.155575,
      "projected_clearance_m": 0.01464853092239049,
      "bending_moment_n_m": 67043.49233583987,
      "bending_stress_pa": 82652686.46243969
    },
    {
      "md_m": 4.0,
      "x_m": 0.04989708956636123,
      "y_m": 0.0,
      "od_radius_m": 0.1016,
      "id_radius_m": 0.0357,
      "hole_radius_m": 0.155575,
      "projected_clearance_m": 0.004077910433638768,
      "bending_moment_n_m": 59396.8267353245,
      "bending_stress_pa": 73225709.55025014
    },
    {
      "md_m": 4.5,
      "x_m": 0.06133882479077736,
      "y_m": 0.0,
      "od_radius_m": 0.1016,
      "id_radius_m": 0.0357,
      "hole_radius_m": 0.155575,
      "projected_clearance_m": -0.007363824790777393,
      "bending_moment_n_m": 52213.59541362901,
      "bending_stress_pa": 64370064.57213362
    },
    {
      "md_m": 5.0,
      "x_m": 0.0735463253745032,
      "y_m": 0.0,
      "od_radius_m": 0.1016,
      "id_radius_m": 0.0357,
      "hole_radius_m": 0.155575,
      "projected_clearance_m": -0.019571325374503235,
      "bending_moment_n_m": 45493.79837075503,
      "bending_stress_pa": 56085751.528092146
    },
    {
      "md_m": 5.5,
      "x_m": 0.08642103867514245,
      "y_m": 0.0,
      "od_radius_m": 0.1016,
      "id_radius_m": 0.0357,
      "hole_radius_m": 0.155575,
      "projected_clearance_m": -0.03244603867514245,
      "bending_moment_n_m": 39237.435606696425,
      "bending_stress_pa": 48372770.418118164
    },
    {
      "md_m": 6.0,
      "x_m": 0.0998712087842571,
      "y_m": 0.0,
      "od_radius_m": 0.1016,
      "id_radius_m": 0.0357,
      "hole_radius_m": 0.155575,
      "projected_clearance_m": -0.04589620878425711,
      "bending_moment_n_m": 33444.507121461706,
      "bending_stress_pa": 41231121.24222216
    },
    {
      "md_m": 6.5,
      "x_m": 0.11381187652736763,
      "y_m": 0.0,
      "od_radius_m": 0.1016,
      "id_radius_m": 0.0357,
      "hole_radius_m": 0.155575,
      "projected_clearance_m": -0.05983687652736766,
      "bending_moment_n_m": 28115.012915057498,
      "bending_stress_pa": 34660804.0004123
    },
    {
      "md_m": 7.0,
      "x_m": 0.128164879463953,
      "y_m": 0.0,
      "od_radius_m": 0.1016,
      "id_radius_m": 0.0357,
      "hole_radius_m": 0.155575,
      "projected_clearance_m": -0.074189879463953,
      "bending_moment_n_m": 23248.952987470555,
      "bending_stress_pa": 28661818.692672256
    },
    {
      "md_m": 7.5,
      "x_m": 0.14285885188745054,
      "y_m": 0.0,
      "od_radius_m": 0.1016,
      "id_radius_m": 0.0357,
      "hole_radius_m": 0.155575,
      "projected_clearance_m": -0.08888385188745054,
      "bending_moment_n_m": 18846.327338696145,
      "bending_stress_pa": 23234165.318996195
    },
    {
      "md_m": 8.0,
      "x_m": 0.15782922482525585,
      "y_m": 0.0,
      "od_radius_m": 0.1016,
      "id_radius_m": 0.0357,
      "hole_radius_m": 0.155575,
      "projected_clearance_m": -0.10385422482525586,
      "bending_moment_n_m": 14907.135968731425,
      "bending_stress_pa": 18377843.87938061
    },
    {
      "md_m": 8.5,
      "x_m": 0.17301822603872277,
      "y_m": 0.0,
      "od_radius_m": 0.1016,
      "id_radius_m": 0.0357,
      "hole_radius_m": 0.155575,
      "projected_clearance_m": -0.1190432260387228,
      "bending_moment_n_m": 11431.37887758397,
      "bending_stress_pa": 14092854.373834841
    },
    {
      "md_m": 9.0,
      "x_m": 0.18837488002316347,
      "y_m": 0.0,
      "od_radius_m": 0.1016,
      "id_radius_m": 0.0357,
      "hole_radius_m": 0.155575,
      "projected_clearance_m": -0.1343998800231635,
      "bending_moment_n_m": 8419.056065270812,
      "bending_stress_pa": 10379196.802379886
    },
    {
      "md_m": 9.5,
      "x_m": 0.2038550080078487,
      "y_m": 0.0,
      "od_radius_m": 0.1016,
      "id_radius_m": 0.0357,
      "hole_radius_m": 0.155575,
      "projected_clearance_m": -0.1498800080078487,
      "bending_moment_n_m": 5870.167531769239,
      "bending_stress_pa": 7236871.164987745
    },
    {
      "md_m": 10.0,
      "x_m": 0.2194212279560075,
      "y_m": 0.0,
      "od_radius_m": 0.1016,
      "id_radius_m": 0.0357,
      "hole_radius_m": 0.155575,
      "projected_clearance_m": -0.1654462279560075,
      "bending_moment_n_m": 3784.7132770792514,
      "bending_stress_pa": 4665877.461658416
    },
    {
      "md_m": 10.5,
      "x_m": 0.23504295456482713,
      "y_m": 0.0,
      "od_radius_m": 0.1016,
      "id_radius_m": 0.0357,
      "hole_radius_m": 0.155575,
      "projected_clearance_m": -0.18106795456482713,
      "bending_moment_n_m": 2162.693301187603,
      "bending_stress_pa": 2666215.6923755715
    },
    {
      "md_m": 11.0,
      "x_m": 0.25069639926545295,
      "y_m": 0.0,
      "od_radius_m": 0.1016,
      "id_radius_m": 0.0357,
      "hole_radius_m": 0.155575,
      "projected_clearance_m": -0.19672139926545296,
      "bending_moment_n_m": 1004.107604117003,
      "bending_stress_pa": 1237885.8571672065
    },
    {
      "md_m": 11.5,
      "x_m": 0.2663645702229887,
      "y_m": 0.0,
      "od_radius_m": 0.1016,
      "id_radius_m": 0.0357,
      "hole_radius_m": 0.155575,
      "projected_clearance_m": -0.2123895702229887,
      "bending_moment_n_m": 308.95618587312896,
      "bending_stress_pa": 380887.9560403209
    },
    {
      "md_m": 12.0,
      "x_m": 0.2820372723364966,
      "y_m": 0.0,
      "od_radius_m": 0.1016,
      "id_radius_m": 0.0357,
      "hole_radius_m": 0.155575,